ID;Text
1;I swear - I don't put pseudo code I get told off for having bad variable names and things that don't match... I put pseudocode and I still get grief!
2;Reinnstalled Xcode4 - same thing. Awful!
3;Yeah, it's definitely annoying!
4;For Python 3 the following will work.
5;I would continue running in the background and set an (called by the os when you app is REALLY killed) and there use
6;If you're really worried about this, Java is not the language for you
7;Do you have jQuery loaded correctly?
8;I want them to resize based on the length of the data they're showing.